{
  "matrix_id": "xinsight.unirouter-execution-evidence.consumer-candidate.field-matrix",
  "matrix_version": "0.1.0-draft",
  "ownership": "x-insight-consumer-side-incubation-candidate",
  "freeze_status": "draft_gate_only",
  "fields": [
    {
      "field_identity": "execution.identity",
      "path": "/evidence/execution_identity",
      "semantic_role": "execution_identity",
      "execution_identity_semantics": "One Source business execution identity; transport delivery does not mint another identity.",
      "operation_protocol_semantics": "Independent of model name and protocol transport retries.",
      "capability_evidence_semantics": "Does not prove a capability by itself.",
      "route_attempt_semantics": "Parent identity for zero or more provider attempts.",
      "usage_semantics": "Usage facts reference this identity and are not copied as new facts.",
      "cost_pricing_reconciliation_semantics": "Cost and later reconciliation reference this identity without replacing terminal facts.",
      "outcome_finality_semantics": "At most one terminal Source fact per source fact identity.",
      "provenance": "Direct Source identity or explicit deterministic derivation only.",
      "lifecycle": "predispatch through post_terminal",
      "cardinality": "exactly_one",
      "sensitivity_privacy": "internal_identifier",
      "ordering": "Stable across duplicate delivery and polling.",
      "absence_gap_unknown_semantics": "Missing identity rejects the candidate; it cannot be synthesized from time.",
      "idempotency_identity": "source_fact_identity plus idempotency_key",
      "revision_of": {"allowed": false, "rule": "Execution identity is not a revision counter."},
      "supersedes": {"allowed": false, "rule": "Correction facts may supersede facts; the execution identity remains stable."},
      "caused_by": {"allowed": false, "rule": "Identity equality is not causality."},
      "relates_to": {"allowed": true, "rule": "A later lifecycle event may reference the same execution."},
      "derived_from": {"allowed": true, "rule": "Only with exact input identity and algorithm provenance."},
      "source_support_status": "source_observed_unreleased",
      "xinsight_projection_target": "draft-only comparator identity",
      "evidence_reference": "UniRouter main internal/executionevidence/public_evidence.go at pinned commit",
      "classification": "draft_common"
    },
    {
      "field_identity": "operation.protocol",
      "path": "/evidence/operation",
      "semantic_role": "operation_protocol",
      "execution_identity_semantics": "Describes the operation bound to the execution identity.",
      "operation_protocol_semantics": "Exact operation family, profile, protocol version, capability type and execution profile version.",
      "capability_evidence_semantics": "Names the observed capability surface but does not claim support without evidence.",
      "route_attempt_semantics": "Attempts must remain within the declared operation and profile.",
      "usage_semantics": "Determines which usage units may be observed, never how to invent them.",
      "cost_pricing_reconciliation_semantics": "Does not select pricing or recompute charges.",
      "outcome_finality_semantics": "Protocol finality remains Source-declared.",
      "provenance": "Exact profile/version observation.",
      "lifecycle": "execution",
      "cardinality": "exactly_one",
      "sensitivity_privacy": "public_identifier",
      "ordering": "Declared before attempt and fact interpretation.",
      "absence_gap_unknown_semantics": "Unknown versions are explicit and cannot fall back by model name.",
      "idempotency_identity": "Included in candidate fixture identity, not a transport key.",
      "revision_of": {"allowed": false, "rule": "A profile change is a new version, not a transport revision."},
      "supersedes": {"allowed": false, "rule": "Version selection does not correct prior facts."},
      "caused_by": {"allowed": false, "rule": "Protocol membership is not causality."},
      "relates_to": {"allowed": true, "rule": "May relate fixtures for the same operation family."},
      "derived_from": {"allowed": true, "rule": "Only exact versioned Source metadata may be transformed."},
      "source_support_status": "source_observed_unreleased",
      "xinsight_projection_target": "candidate operation binding",
      "evidence_reference": "Pinned UniRouter endpoint protocol manifests",
      "classification": "family_specific"
    },
    {
      "field_identity": "capability.reference",
      "path": "/evidence/capability_evidence",
      "semantic_role": "capability_reference",
      "execution_identity_semantics": "Attached to one execution without becoming its identity.",
      "operation_protocol_semantics": "Bound to the exact operation/profile tuple.",
      "capability_evidence_semantics": "Known requires a reference and raw content hash; gap and unknown require null reference.",
      "route_attempt_semantics": "Does not choose a route or provider.",
      "usage_semantics": "Does not imply usage completeness.",
      "cost_pricing_reconciliation_semantics": "Does not imply pricing eligibility.",
      "outcome_finality_semantics": "Does not imply success or terminality.",
      "provenance": "Reference plus content digest when known.",
      "lifecycle": "predispatch or execution",
      "cardinality": "exactly_one",
      "sensitivity_privacy": "sensitive_reference_only",
      "ordering": "Observed binding precedes any interpretation.",
      "absence_gap_unknown_semantics": "gap and unknown are first-class and never auto-filled.",
      "idempotency_identity": "Reference digest is content identity, not delivery identity.",
      "revision_of": {"allowed": true, "rule": "Only a Source-declared revision of the same capability fact."},
      "supersedes": {"allowed": true, "rule": "Only a correction of an erroneous prior reference."},
      "caused_by": {"allowed": false, "rule": "Capability membership does not imply cause."},
      "relates_to": {"allowed": true, "rule": "General association is permitted."},
      "derived_from": {"allowed": true, "rule": "Exact upstream reference and provenance are required."},
      "source_support_status": "unknown",
      "xinsight_projection_target": "candidate capability reference only",
      "evidence_reference": "Draft fixtures and exact Source refs where available",
      "classification": "candidate_common"
    },
    {
      "field_identity": "route.attempt",
      "path": "/evidence/attempts",
      "semantic_role": "route_attempt",
      "execution_identity_semantics": "Attempt identities are children of one execution, not replacement executions.",
      "operation_protocol_semantics": "Attempt provider and route stay under the declared protocol profile.",
      "capability_evidence_semantics": "Attempt presence does not prove general capability support.",
      "route_attempt_semantics": "Ordinal is contiguous; predispatch denial has no provider attempt.",
      "usage_semantics": "Attempt usage remains Source evidence and is not summed unless declared.",
      "cost_pricing_reconciliation_semantics": "Attempt cost does not become customer charge without Source finality.",
      "outcome_finality_semantics": "Failed attempts may precede one terminal success or cancellation.",
      "provenance": "Direct Source attempt identity.",
      "lifecycle": "attempt",
      "cardinality": "zero_or_more",
      "sensitivity_privacy": "internal_identifier",
      "ordering": "Strict ordinal starting at one.",
      "absence_gap_unknown_semantics": "Zero attempts is valid only for predispatch outcomes.",
      "idempotency_identity": "attempt_id within execution identity",
      "revision_of": {"allowed": false, "rule": "Retry is a new attempt, not a Source fact revision."},
      "supersedes": {"allowed": false, "rule": "Fallback does not erase a failed attempt."},
      "caused_by": {"allowed": true, "rule": "Only an explicit Source parent event and exact identity."},
      "relates_to": {"allowed": true, "rule": "Request or attempt association stays non-causal."},
      "derived_from": {"allowed": true, "rule": "Only deterministic conversion with input identities."},
      "source_support_status": "source_observed_unreleased",
      "xinsight_projection_target": "candidate attempt list",
      "evidence_reference": "Pinned UniRouter execution evidence code observations",
      "classification": "draft_common"
    },
    {
      "field_identity": "fact.usage",
      "path": "/evidence/facts[kind=usage]",
      "semantic_role": "usage",
      "execution_identity_semantics": "One usage Source fact per source identity.",
      "operation_protocol_semantics": "Units remain protocol/profile scoped.",
      "capability_evidence_semantics": "Usage is evidence for one execution, not support breadth.",
      "route_attempt_semantics": "Attempt attribution is preserved when Source declares it.",
      "usage_semantics": "No duplicate total or inferred missing units.",
      "cost_pricing_reconciliation_semantics": "Usage never silently recomputes cost.",
      "outcome_finality_semantics": "Streaming usage is accepted only at Source terminal finality.",
      "provenance": "Direct or source-declared derivation.",
      "lifecycle": "terminal",
      "cardinality": "zero_or_one",
      "sensitivity_privacy": "aggregate_only",
      "ordering": "After attempt observations and at terminal finality.",
      "absence_gap_unknown_semantics": "Missing terminal usage is gap/unknown, never zero.",
      "idempotency_identity": "source usage fact identity",
      "revision_of": {"allowed": true, "rule": "Only same Source fact revision."},
      "supersedes": {"allowed": true, "rule": "Only explicit correction, preserving prior fact."},
      "caused_by": {"allowed": false, "rule": "Token totals do not prove causality."},